{
  "id": "chelsea-circle-usdc",
  "clubId": "chelsea",
  "orgName": null,
  "sponsorId": "circle-usdc",
  "placement": "front",
  "from": null,
  "to": null,
  "value": null,
  "source": {
    "name": "Score and Change, Overview of the 2026/2027 Premier League sponsors",
    "date": "2026-09-17",
    "url": "https://www.scoreandchange.com/overview-of-the-2026-2027-premier-league-sponsors/"
  },
  "note": "USDC stablecoin branding; replaces the front that had been vacant."
}
