{
  "id": "uefa-vodafone-uwcl",
  "clubId": null,
  "orgName": "UEFA Women's Champions League",
  "sponsorId": "vodafone",
  "placement": "league-partner",
  "from": null,
  "to": null,
  "value": null,
  "source": {
    "name": "UEFA.com",
    "date": "2025-12-17",
    "url": "https://www.uefa.com/news-media/news/02a0-1f75c472f4d9-77c69b2201ef-1000--uefa-and-euronics-group-sign-uefa-women-s-champions-league/"
  },
  "leagueId": "uefa"
}
