{
  "id": "crystal-palace-temporal",
  "clubId": "crystal-palace",
  "orgName": null,
  "sponsorId": "temporal",
  "placement": "front",
  "from": "2026-27",
  "to": null,
  "value": null,
  "source": {
    "name": "SportsPro, Crystal Palace partner with AI-sector shirt sponsor after betting ban",
    "date": "2026-07",
    "url": "https://www.sportspro.com/news/sponsorship-marketing/crystal-palace-ai-sector-shirt-sponsor-betting-ban/"
  }
}
