{
  "id": "haas-commscope",
  "clubId": "haas",
  "orgName": null,
  "sponsorId": "commscope",
  "placement": "partner",
  "from": "2026",
  "to": null,
  "value": null,
  "source": {
    "name": "Sector – Haas 2026 F1 car launch reveals new partners (livery positions)",
    "date": "2026-01-19",
    "url": "https://sector.world/2026/01/haas-2026-f1-car-launch-reveals-new-partners/"
  },
  "note": "TGR Haas F1 Team other partner on the 2026 car."
}
