{
  "id": "fifa-verizon",
  "clubId": null,
  "orgName": "FIFA",
  "sponsorId": "verizon",
  "placement": "league-partner",
  "from": null,
  "to": null,
  "value": null,
  "source": {
    "name": "FIFA - Verizon named Official Telecommunication Services Sponsor for FIFA World Cup 26",
    "date": "2024-09-24",
    "url": "https://inside.fifa.com/tournaments/mens/worldcup/canadamexicousa2026/media-releases/verizon-named-official-telecommunication-services-sponsor-for-fifa-world-cup"
  },
  "leagueId": "fifa"
}
