{
  "id": "denver-broncos-childrens-hospital-colorado-patch",
  "clubId": "denver-broncos",
  "orgName": "Children's Hospital Colorado",
  "sponsorId": "childrens-hospital-colorado",
  "placement": "training-kit",
  "from": "2024",
  "to": null,
  "value": null,
  "source": {
    "name": "Denver Broncos",
    "date": "2024-07-24",
    "url": "https://www.denverbroncos.com/news/broncos-renew-and-expand-partnership-with-children-s-hospital-colorado"
  },
  "note": "Practice-jersey patch."
}
