{
  "id": "atletico-de-madrid-riyadh-air",
  "clubId": "atletico-de-madrid",
  "orgName": null,
  "sponsorId": "riyadh-air",
  "placement": "front",
  "from": "2026-27",
  "to": null,
  "value": null,
  "source": {
    "name": "Score and Change, Overview of the 2026/2027 La Liga sponsors",
    "date": "2026-09-06",
    "url": "https://www.scoreandchange.com/la-liga-sponsors/"
  },
  "leagueId": "la-liga"
}
