{
  "id": "cadillac-tenneco",
  "clubId": "cadillac",
  "orgName": null,
  "sponsorId": "tenneco",
  "placement": "partner",
  "from": "2026",
  "to": null,
  "value": null,
  "source": {
    "name": "Cadillac Formula 1 Team – Official Partners",
    "date": "2026-09-24",
    "url": "https://www.cadillacf1team.com/partners"
  },
  "note": "Cadillac Formula 1 Team other partner on the 2026 car."
}
