{
  "id": "premier-league-barclays",
  "clubId": null,
  "orgName": "Barclays",
  "sponsorId": "barclays",
  "placement": "league-partner",
  "from": "2026-27",
  "to": null,
  "value": null,
  "source": {
    "name": "Premier League, official commercial partners and licensees",
    "date": "2026-09-24",
    "url": "https://www.premierleague.com/en/about/partners"
  },
  "note": "Premier League Official Bank"
}
