{
  "id": "sc-paderborn-07-c-hedenkamp",
  "clubId": "sc-paderborn-07",
  "orgName": null,
  "sponsorId": "c-hedenkamp",
  "placement": "front",
  "from": "2026-27",
  "to": null,
  "value": null,
  "source": {
    "name": "Deutsches Institut fuer Marketing, Trikotsponsoren der Bundesliga (stand 4 Aug 2026)",
    "date": "2026-08-04",
    "url": "https://www.marketinginstitut.biz/blog/trikotsponsoren-bundesliga/"
  },
  "note": "Value not disclosed."
}
