{
  "id": "mclaren-dell",
  "clubId": "mclaren",
  "orgName": null,
  "sponsorId": "dell",
  "placement": "partner",
  "from": "2026",
  "to": null,
  "value": null,
  "source": {
    "name": "McLaren Racing – Partners",
    "date": "2026-09-24",
    "url": "https://www.mclaren.com/racing/partners/"
  },
  "note": "McLaren Mastercard F1 Team other partner on the 2026 car."
}
